{
  "$schema": "https://json-schema.org/draft/2020-12/schema",
  "title": "McpBinding",
  "type": "object",
  "required": ["id", "name", "server_name", "transport", "risk_level", "status"],
  "properties": {
    "id": {"type": "string"},
    "name": {"type": "string"},
    "server_name": {"type": "string"},
    "transport": {"type": "string", "enum": ["stdio", "sse", "http"]},
    "command": {"type": ["string", "null"]},
    "args": {"type": "array", "items": {"type": "string"}},
    "env": {"type": "object"},
    "capabilities": {"type": "array", "items": {"type": "string"}},
    "allowed_tools": {"type": "array", "items": {"type": "string"}},
    "risk_level": {"type": "string", "enum": ["low", "medium", "high"]},
    "status": {"type": "string", "enum": ["active", "inactive", "deprecated"]},
    "namespace": {"type": "string"},
    "scope": {"type": "array", "items": {"type": "string"}},
    "owner_actor_id": {"type": ["string", "null"]}
  },
  "additionalProperties": false
}
